{
  "schema_version": "1.0.0",
  "id": "traj_2026-10-19_000123",

  "provenance": {
    "source_id": "mentee_synth_v1",
    "source_url": "internal",
    "source_sha256": "3f9a1c0e5b7d2a4f8c6e1b3d9a7f5e2c4b8d6a0f2e4c6b8d0a2f4e6c8b0d2a4f",
    "license": "Apache-2.0",
    "license_verified": true,
    "redistributable": true,
    "trainable": true,
    "teacher": {
      "model": "Qwen/Qwen3-Coder-Next",
      "revision": "main@2026-10-19",
      "license": "Apache-2.0",
      "sampling": {
        "temperature": 1.0,
        "top_p": 0.95,
        "top_k": 40
      },
      "quantization": "awq",
      "served_by": "self-hosted"
    },
    "generator": {
      "code_version": "git:9c1d2e3",
      "prompt_template": "swe_agent_v3",
      "harness": "mentee-swe"
    },
    "collected_at": "2026-10-19T14:03:11Z",
    "collected_by": "human:syab"
  },

  "task": {
    "instruction": "Fix the off-by-one in parse_window() so that an empty window returns an empty list instead of raising IndexError.",
    "issue_url": "https://github.com/acme/windowlib/issues/412",
    "language": "python",
    "task_type": "bug_fix",
    "difficulty": "medium",
    "constraints": [
      "Do not change the public signature of parse_window()",
      "Do not add new dependencies"
    ],
    "acceptance_criteria": [
      "pytest tests/test_parser.py::test_empty_window passes",
      "all other tests in tests/test_parser.py still pass"
    ],
    "outcome": "solved"
  },

  "environment": {
    "repo": "acme/windowlib",
    "repo_license": "MIT",
    "repo_url": "https://github.com/acme/windowlib",
    "base_commit": "9f2c1ab7d3e5f60718293a4b5c6d7e8f901122334",
    "setup_script": "python -m pip install -e . && python -m pip install -r requirements-dev.txt",
    "test_command": "python -m pytest -q tests/test_parser.py",
    "fail_to_pass": ["tests/test_parser.py::test_empty_window"],
    "pass_to_pass": [
      "tests/test_parser.py::test_basic_window",
      "tests/test_parser.py::test_partial_window",
      "tests/test_parser.py::test_full_window"
    ],
    "runtime": {
      "image": "python:3.11-slim",
      "image_digest": "sha256:8f2a1c9d4e7b3a6c0d5f1e8b2a4c7d9e0f3a6b1c",
      "timeout_s": 900,
      "network": false,
      "cpu_limit": 2,
      "memory_limit_mb": 4096
    }
  },

  "trajectory": {
    "turns": [
      {
        "index": 0,
        "role": "system",
        "content": "You are a coding agent working in a Python repository. Use the provided tools to investigate, edit, and verify..."
      },
      {
        "index": 1,
        "role": "user",
        "content": "Fix the off-by-one in parse_window() so that an empty window returns an empty list instead of raising IndexError."
      },
      {
        "index": 2,
        "role": "assistant",
        "content": "I'll start by reading the parser module.",
        "tool_calls": [
          {
            "id": "call_0",
            "name": "read_file",
            "arguments": { "path": "src/windowlib/parser.py", "start_line": 40, "end_line": 92 },
            "arguments_raw": "{\"path\":\"src/windowlib/parser.py\",\"start_line\":40,\"end_line\":92}"
          }
        ]
      },
      {
        "index": 3,
        "role": "tool_result",
        "tool_call_id": "call_0",
        "name": "read_file",
        "content": "def parse_window(tokens, size):\n    start = tokens.index('[')\n    end = tokens.index(']')\n    body = tokens[start + 1:end]\n    return body[0:size - 1]\n",
        "truncated": false,
        "content_bytes": 168
      },
      {
        "index": 4,
        "role": "assistant",
        "content": "The slice `body[0:size - 1]` drops the last element and raises IndexError on an empty body. Let me look at the test file to confirm the expected behaviour before editing.",
        "tool_calls": [
          {
            "id": "call_1",
            "name": "read_file",
            "arguments": { "path": "tests/test_parser.py", "start_line": 1, "end_line": 60 },
            "arguments_raw": "{\"path\":\"tests/test_parser.py\",\"start_line\":1,\"end_line\":60}"
          }
        ]
      },
      {
        "index": 5,
        "role": "tool_result",
        "tool_call_id": "call_1",
        "name": "read_file",
        "content": "import pytest\nfrom windowlib.parser import parse_window\n\ndef test_empty_window():\n    assert parse_window(['[', ']'], 3) == []\n\ndef test_basic_window():\n    assert parse_window(['[', 'a', 'b', ']'], 2) == ['a']\n",
        "truncated": false,
        "content_bytes": 254
      },
      {
        "index": 6,
        "role": "assistant",
        "content": "Confirmed: the expected result is the first `size - 1` elements, and an empty body should yield `[]`. The current slice already returns `[]` for an empty body, so the IndexError must come from elsewhere — let me run the failing test to see the real traceback before patching.",
        "tool_calls": [
          {
            "id": "call_2",
            "name": "execute_command",
            "arguments": { "command": "python -m pytest -q tests/test_parser.py::test_empty_window" },
            "arguments_raw": "{\"command\":\"python -m pytest -q tests/test_parser.py::test_empty_window\"}"
          }
        ]
      },
      {
        "index": 7,
        "role": "tool_result",
        "tool_call_id": "call_2",
        "name": "execute_command",
        "content": "FAILED tests/test_parser.py::test_empty_window\nE   IndexError: list index out of range\nE   assert parse_window(['[', ']'], 3) == []\n",
        "truncated": false,
        "content_bytes": 132
      },
      {
        "index": 8,
        "role": "assistant",
        "content": "The traceback points at `tokens.index(']')` failing to find the closing bracket in some input — but the failing input does contain `']'`. Let me read the full function including the lines above 40 to see the real implementation.",
        "tool_calls": [
          {
            "id": "call_3",
            "name": "read_file",
            "arguments": { "path": "src/windowlib/parser.py", "start_line": 1, "end_line": 45 },
            "arguments_raw": "{\"path\":\"src/windowlib/parser.py\",\"start_line\":1,\"end_line\":45}"
          }
        ]
      },
      {
        "index": 9,
        "role": "tool_result",
        "tool_call_id": "call_3",
        "name": "read_file",
        "content": "def parse_window(tokens, size):\n    if not tokens:\n        return tokens.index('[')      # <-- IndexError when tokens is empty\n    start = tokens.index('[')\n    end = tokens.index(']')\n    body = tokens[start + 1:end]\n    return body[0:size - 1]\n",
        "truncated": false,
        "content_bytes": 214
      },
      {
        "index": 10,
        "role": "assistant",
        "content": "Found it — the guard on line 42 returns `tokens.index('[')` instead of an empty list. My first hypothesis about the slice was wrong; running the test was what corrected it. Now I'll patch the guard.",
        "tool_calls": [
          {
            "id": "call_4",
            "name": "apply_patch",
            "arguments": {
              "path": "src/windowlib/parser.py",
              "old_string": "    if not tokens:\n        return tokens.index('[')",
              "new_string": "    if not tokens:\n        return []"
            },
            "arguments_raw": "{\"path\":\"src/windowlib/parser.py\",\"old_string\":\"    if not tokens:\\n        return tokens.index('[')\",\"new_string\":\"    if not tokens:\\n        return []\"}"
          }
        ]
      },
      {
        "index": 11,
        "role": "tool_result",
        "tool_call_id": "call_4",
        "name": "apply_patch",
        "content": "Applied patch to src/windowlib/parser.py (+1 -1)",
        "truncated": false,
        "content_bytes": 46
      },
      {
        "index": 12,
        "role": "assistant",
        "content": "Patch applied. Running the full parser test file to confirm the fix and check for regressions.",
        "tool_calls": [
          {
            "id": "call_5",
            "name": "execute_command",
            "arguments": { "command": "python -m pytest -q tests/test_parser.py" },
            "arguments_raw": "{\"command\":\"python -m pytest -q tests/test_parser.py\"}"
          }
        ]
      },
      {
        "index": 13,
        "role": "tool_result",
        "tool_call_id": "call_5",
        "name": "execute_command",
        "content": "4 passed in 0.31s",
        "truncated": false,
        "content_bytes": 19
      }
    ],

    "patches": [
      {
        "path": "src/windowlib/parser.py",
        "diff": "--- a/src/windowlib/parser.py\n+++ b/src/windowlib/parser.py\n@@ -39,7 +39,7 @@\n def parse_window(tokens, size):\n     if not tokens:\n-        return tokens.index('[')\n+        return []\n     start = tokens.index('[')\n",
        "applied": true
      }
    ],

    "n_turns": 14,
    "stop_reason": "completed",
    "duration_s": 512.4,
    "total_tokens": { "input": 21480, "output": 1390 }
  },

  "verification": {
    "status": "pass",
    "verifier": "docker-runner@1.2.0",
    "verified_at": "2026-10-19T15:22:40Z",
    "tests": {
      "fail_to_pass": { "before": "FAIL", "after": "PASS" },
      "pass_to_pass": { "before": "PASS", "after": "PASS", "total": 3, "regressed": 0 }
    },
    "regressions": [],
    "sandbox": {
      "image_digest": "sha256:8f2a1c9d4e7b3a6c0d5f1e8b2a4c7d9e0f3a6b1c",
      "network": false,
      "timeout_s": 900
    }
  },

  "quality": {
    "verified": true,
    "score": 0.94,
    "checks": {
      "schema_valid": true,
      "no_truncated_tool_output": true,
      "has_failure_path": true,
      "no_secrets": true,
      "no_hallucinated_paths": true,
      "patch_applies": true,
      "regressions": 0,
      "token_length_ok": true,
      "dedup_cluster": "cl_9f3a2b"
    },
    "rejected_by": [],
    "filter_notes": []
  },

  "split": {
    "partition": "train",
    "reason": "commit_date_before_2026-07-01",